{
  "id": "2119b3b7-921e-48d9-94b9-f6a2e598ebdc",
  "name": "",
  "parentProductRole": "Collection",
  "childProductRole": "Item",
  "auditInfo": {
    "createdDate": "2023-12-12T19:24:05Z",
    "createdBy": "Application Admin",
    "updatedDate": "2023-12-12T19:24:05Z",
    "updatedBy": "Application Admin",
    "isDeleted": true
  }
}